{
  "$schema": "./media.manifest.schema.json",
  "versao": 1,
  "notas": "Originais em media-originais/ (intactos, só git mv). Derivados gerados por scripts/prepare-media.mjs em public/media/ (fora do git). Tempos em segundos do arquivo original; vídeos a 30 qps. Campos 't' de pôster e quadro são preenchidos por scripts/extract-stills.mjs (quadro mais nítido da janela).",
  "originais": [
    {
      "id": "experiencia-babearia-verdadeira",
      "arquivo": "media-originais/videos/experiencia-babearia-verdadeira.mp4",
      "tipo": "video",
      "sha256": "6bfd0f4bc5ec4ce22a94c29b8402838ca7e7b721d33d39348413efd50b1ae35b",
      "largura": 720,
      "altura": 1280,
      "duracao": 59.487,
      "postOrigem": {
        "codigo": "DUbAeAMgLCK",
        "estado": "indicado",
        "nota": "Indicado no mapa de mídia."
      },
      "legendaLiteral": "Experiência de barbearia de verdade! Precisão em cada detalhe e excelência no resultado!",
      "uso": "Loop do hero (16,6–22,9 s) e vídeo completo na seção Barba; quadros: máquina vinho, navalha, resultado, retrato provisório do Pedro.",
      "trechos": [],
      "audioLiberado": false,
      "problemas": ["Trilha do Instagram: sai muda.", "Pedro de máscara em 24–26 s e 31–33 s."],
      "edicoes": [],
      "naoUsar": false
    },
    {
      "id": "corte1",
      "arquivo": "media-originais/videos/corte1.mp4",
      "tipo": "video",
      "sha256": "97b0a3fce01287cbb941725bfea5cdd73cd84dfb9d80f8e0d2540bd07fcee122",
      "largura": 720,
      "altura": 1280,
      "duracao": 54.03,
      "postOrigem": {
        "codigo": null,
        "estado": "pendente",
        "nota": "Sem acesso ao Instagram nesta sessão. Candidatos citados na investigação (não conferidos): DXKB3kGDqsq (degradê na shaver), DX7q5jxvWai (acabamento na shaver)."
      },
      "legendaLiteral": null,
      "uso": "Loop do degradê (nuca + pezinho); quadros: plano geral com parede verde, Pedro concentrado, retrato provisório.",
      "trechos": [],
      "audioLiberado": false,
      "problemas": ["Trilha do Instagram: sai muda."],
      "edicoes": [],
      "naoUsar": false
    },
    {
      "id": "corte-acabamento",
      "arquivo": "media-originais/videos/corte-acabamento.mp4",
      "tipo": "video",
      "sha256": "8d6fde086e00efd41127e2ad9914bacc616ca6a089d1173c41dee6541ab87456",
      "largura": 720,
      "altura": 1280,
      "duracao": 34.827,
      "postOrigem": {
        "codigo": null,
        "estado": "pendente",
        "nota": "Sem acesso ao Instagram nesta sessão. Candidatos não conferidos: DXKB3kGDqsq, DX7q5jxvWai."
      },
      "legendaLiteral": null,
      "uso": "Resultado final (giro 26,6–34,8 s); quadros de perfil e nuca.",
      "trechos": [],
      "audioLiberado": false,
      "problemas": [
        "Celular na mão de alguém ao fundo em 10–12 s e Pedro com celular em ~4 s: fora dos trechos usados.",
        "Trilha do Instagram: sai muda."
      ],
      "edicoes": [],
      "naoUsar": false
    },
    {
      "id": "corte2",
      "arquivo": "media-originais/videos/corte2.mp4",
      "tipo": "video",
      "sha256": "bbe7b8e61323437e3847718bf569818dd01ddb6c7d987580db8b75db46215c58",
      "largura": 720,
      "altura": 1280,
      "duracao": 62.18,
      "postOrigem": {
        "codigo": null,
        "estado": "pendente",
        "nota": "Sem acesso ao Instagram nesta sessão. Candidatos não conferidos: DXKB3kGDqsq, DX7q5jxvWai."
      },
      "legendaLiteral": null,
      "uso": "Segundo resultado (ângulos 43,6–60,3 s).",
      "trechos": [],
      "audioLiberado": false,
      "problemas": [
        "60,5–62,2 s: transição e vinheta com o logo raster 3D e poste de barbeiro. Fica fora de qualquer derivado.",
        "Trilha do Instagram: sai muda."
      ],
      "edicoes": [],
      "naoUsar": false
    },
    {
      "id": "bastidores",
      "arquivo": "media-originais/videos/bastidores.mp4",
      "tipo": "video",
      "sha256": "3bce7d71461cb7708ff7d7e0dc6a3dd07ce458137ba3da6d8b91cb5e4d86283f",
      "largura": 720,
      "altura": 1280,
      "duracao": 56.329,
      "postOrigem": {
        "codigo": "DZ0-DLwN-d1",
        "estado": "indicado",
        "nota": "Indicado no mapa de mídia."
      },
      "legendaLiteral": "Bastidores da barbearia! Confere como é um dia com muita resenha e cortes!",
      "uso": "Página Sobre / 'Um dia aqui' (sem o selo e sem a agenda); quadros: plano geral da barbearia, café.",
      "trechos": [],
      "audioLiberado": false,
      "audioCandidato": {
        "trechos": [
          {
            "in": 43.55,
            "out": 56.19
          }
        ],
        "nota": "Fala do Pedro para a câmera. Liberar só depois de o João confirmar que não há música comercial por baixo."
      },
      "problemas": [
        "0–2,5 s: selo 'BASTIDORES BARBEARIA' queimado. Removido por corte.",
        "7,0–8,8 s: tela do app de agenda (possíveis nomes de clientes). Removido por corte.",
        "56,2 s: último quadro preto."
      ],
      "edicoes": [],
      "naoUsar": false
    },
    {
      "id": "qual-pomada-certa",
      "arquivo": "media-originais/videos/qual-pomada-certa.mp4",
      "tipo": "video",
      "sha256": "64521d2872e3162ec6b17defb60fd28f22f5720d08bdc0add1934c32fd9ccbe7",
      "largura": 720,
      "altura": 1280,
      "duracao": 38.821,
      "postOrigem": {
        "codigo": "DWPtNZOD9Pw",
        "estado": "indicado",
        "nota": "Indicado no mapa e na investigação."
      },
      "legendaLiteral": "Nem toda pomada é igual… e usar a errada pode acabar com seu cabelo 👀 Brilho, fixação, efeito seco…",
      "uso": "Página /pomadas (vídeo inteiro); retrato provisório do Pedro (rosto de frente).",
      "trechos": [],
      "audioLiberado": false,
      "audioCandidato": {
        "trechos": [
          {
            "in": 0,
            "out": 38.82
          }
        ],
        "nota": "O Pedro fala o vídeo todo. Liberar só depois de o João confirmar que não há música comercial por baixo."
      },
      "problemas": [
        "Legenda no mapa termina em reticências: pode estar truncada.",
        "Legendas queimadas em todo o vídeo (texto de fala) e inserções de produto com marcas.",
        "36–37 s: CTA queimado 'Segue esse perfil', que não faz sentido no site. Avaliar cortar o final."
      ],
      "edicoes": [],
      "naoUsar": false
    },
    {
      "id": "primeiro-video",
      "arquivo": "media-originais/videos/primeiro-video.mp4",
      "tipo": "video",
      "sha256": "9746cfd8f86c43fd50c56d771d96f57157944dbeef04a3bd69cab31a05c5e68c",
      "largura": 720,
      "altura": 1280,
      "duracao": 61.23,
      "postOrigem": {
        "codigo": "DMdJJJdu5AW",
        "estado": "provavel",
        "nota": "Mapa indica 'provável'."
      },
      "legendaLiteral": "Mais que um corte, uma experiência 💈 Atendimento com respeito, excelência e cuidado com cada detalhe!",
      "uso": "Página Sobre (trajetória), uso médio.",
      "trechos": [],
      "audioLiberado": false,
      "problemas": [
        "Qualidade menor que os demais.",
        "Pedro de máscara em parte do vídeo.",
        "Abre com poste de barbeiro físico (objeto real, não ilustração).",
        "Trilha do Instagram: sai muda."
      ],
      "edicoes": [],
      "naoUsar": false
    },
    {
      "id": "seu-visual-fala",
      "arquivo": "media-originais/videos/seu-visual-fala-antes-de-qualquer-coisa.mp4",
      "tipo": "video",
      "sha256": "8b12982ac1e41f797ef45eb8b0d668f6f199267e6a7a7a527e5071e76c08f278",
      "largura": 720,
      "altura": 1280,
      "duracao": 8.263,
      "postOrigem": {
        "codigo": null,
        "estado": "pendente",
        "nota": "Post fixado com 4.171 visualizações; código não registrado."
      },
      "legendaLiteral": null,
      "uso": "Nenhum como vídeo. A frase queimada vira texto (citação do Pedro).",
      "trechos": [],
      "audioLiberado": false,
      "problemas": [
        "Texto queimado: 'Seu visual fala antes de qualquer palavra. Faça ele transmitir confiança.'"
      ],
      "edicoes": [],
      "naoUsar": true,
      "motivoNaoUsar": "Texto queimado; a frase entra no site como texto."
    },
    {
      "id": "foto-barbaterapia-toalha",
      "arquivo": "media-originais/fotos/SaveClip.App_856610241_122104126131512758_229869556221299606_n.jpg",
      "tipo": "foto",
      "sha256": "4012af0cb5485fab1c6ad0cd6c6c3bbf75f21e8c3ed81a4103cbdadb2dc6d1fa",
      "largura": 1080,
      "altura": 1350,
      "postOrigem": {
        "codigo": "Dewh0h2DoBP",
        "estado": "provavel",
        "nota": "Série da barbaterapia (post de 21/10/2026 citado na investigação). Ordem no carrossel não conferida."
      },
      "legendaLiteral": null,
      "uso": "Barbaterapia, passo 'toalha quente' (derivado recortado).",
      "trechos": [],
      "audioLiberado": false,
      "problemas": [
        "Texto 'Toalha quente' (y ≈ 1003+), WhatsApp, endereço com 'Nº 205' e logo (canto superior direito, até y ≈ 226) queimados.",
        "Mesma foto do 858788059 ('Creme e massagem')."
      ],
      "edicoes": [],
      "naoUsar": false
    },
    {
      "id": "foto-barbaterapia-esfoliacao",
      "arquivo": "media-originais/fotos/SaveClip.App_857872880_122104125921512758_4288702109058299548_n.jpg",
      "tipo": "foto",
      "sha256": "48cda9cd3dfe81a42d8182f3f26466cd49c65e8e62583752cf30d9809e6388c0",
      "largura": 1080,
      "altura": 1350,
      "postOrigem": {
        "codigo": "Dewh0h2DoBP",
        "estado": "provavel",
        "nota": "Série da barbaterapia."
      },
      "legendaLiteral": null,
      "uso": "Barbaterapia, passo 'esfoliação' (derivado recortado).",
      "trechos": [],
      "audioLiberado": false,
      "problemas": ["Texto 'Esfoliação' (y ≈ 1003+), rodapé e logo queimados."],
      "edicoes": [],
      "naoUsar": false
    },
    {
      "id": "foto-barbaterapia-creme",